{
  "$schema": "https://json-schema.org/draft/2020-12/schema",
  "$id": "https://mb3r-lab.github.io/Bering/schema/snapshot/v1.1.0/snapshot.schema.json",
  "title": "BeringDiscoverySnapshot",
  "type": "object",
  "required": [
    "snapshot_id",
    "topology_version",
    "window_start",
    "window_end",
    "ingest",
    "counts",
    "coverage",
    "sources",
    "diff",
    "discovery",
    "model",
    "metadata"
  ],
  "properties": {
    "snapshot_id": { "type": "string" },
    "topology_version": { "type": "string" },
    "window_start": { "type": "string", "format": "date-time" },
    "window_end": { "type": "string", "format": "date-time" },
    "ingest": {
      "type": "object",
      "required": ["spans", "traces", "dropped_spans", "late_spans"],
      "properties": {
        "spans": { "type": "integer", "minimum": 0 },
        "traces": { "type": "integer", "minimum": 0 },
        "dropped_spans": { "type": "integer", "minimum": 0 },
        "late_spans": { "type": "integer", "minimum": 0 }
      }
    },
    "counts": {
      "type": "object",
      "required": ["services", "edges", "endpoints"],
      "properties": {
        "services": { "type": "integer", "minimum": 0 },
        "edges": { "type": "integer", "minimum": 0 },
        "endpoints": { "type": "integer", "minimum": 0 }
      }
    },
    "coverage": {
      "type": "object",
      "required": ["confidence", "service_support_min", "edge_support_min", "endpoint_support_min"],
      "properties": {
        "confidence": { "type": "number", "minimum": 0, "maximum": 1 },
        "service_support_min": { "type": "integer", "minimum": 0 },
        "edge_support_min": { "type": "integer", "minimum": 0 },
        "endpoint_support_min": { "type": "integer", "minimum": 0 }
      }
    },
    "sources": {
      "type": "array",
      "items": {
        "type": "object",
        "required": ["type"],
        "properties": {
          "type": { "type": "string" },
          "connector": { "type": "string" },
          "ref": { "type": "string" },
          "observations": { "type": "integer", "minimum": 0 }
        }
      }
    },
    "diff": {
      "type": "object",
      "required": [
        "added_services",
        "removed_services",
        "changed_services",
        "added_edges",
        "removed_edges",
        "changed_edges",
        "added_endpoints",
        "removed_endpoints",
        "changed_endpoints"
      ],
      "properties": {
        "added_services": { "type": "integer", "minimum": 0 },
        "removed_services": { "type": "integer", "minimum": 0 },
        "changed_services": { "type": "integer", "minimum": 0 },
        "added_edges": { "type": "integer", "minimum": 0 },
        "removed_edges": { "type": "integer", "minimum": 0 },
        "changed_edges": { "type": "integer", "minimum": 0 },
        "added_endpoints": { "type": "integer", "minimum": 0 },
        "removed_endpoints": { "type": "integer", "minimum": 0 },
        "changed_endpoints": { "type": "integer", "minimum": 0 }
      }
    },
    "discovery": {
      "type": "object",
      "required": ["services", "edges", "endpoints"],
      "properties": {
        "services": {
          "type": "array",
          "items": { "$ref": "#/$defs/serviceRecord" }
        },
        "edges": {
          "type": "array",
          "items": { "$ref": "#/$defs/edgeRecord" }
        },
        "endpoints": {
          "type": "array",
          "items": { "$ref": "#/$defs/endpointRecord" }
        },
        "overlays": {
          "type": "array",
          "items": {
            "type": "object",
            "required": ["name", "precedence"],
            "properties": {
              "name": { "type": "string" },
              "ref": { "type": "string" },
              "precedence": { "type": "integer", "minimum": 0 }
            }
          }
        }
      }
    },
    "model": {
      "type": "object",
      "required": ["services", "edges", "endpoints", "metadata"],
      "properties": {
        "services": {
          "type": "array",
          "items": { "$ref": "#/$defs/modelService" }
        },
        "edges": {
          "type": "array",
          "items": { "$ref": "#/$defs/modelEdge" }
        },
        "endpoints": {
          "type": "array",
          "items": { "$ref": "#/$defs/modelEndpoint" }
        },
        "metadata": {
          "type": "object",
          "required": ["source_type", "source_ref", "discovered_at", "confidence", "schema"],
          "properties": {
            "source_type": { "type": "string" },
            "source_ref": { "type": "string" },
            "discovered_at": { "type": "string", "format": "date-time" },
            "confidence": { "type": "number", "minimum": 0, "maximum": 1 },
            "schema": { "$ref": "#/$defs/schemaRef" }
          }
        }
      }
    },
    "metadata": {
      "type": "object",
      "required": ["source_type", "source_ref", "emitted_at", "confidence", "schema"],
      "properties": {
        "source_type": { "type": "string" },
        "source_ref": { "type": "string" },
        "emitted_at": { "type": "string", "format": "date-time" },
        "confidence": { "type": "number", "minimum": 0, "maximum": 1 },
        "schema": { "$ref": "#/$defs/schemaRef" }
      }
    }
  },
  "$defs": {
    "schemaRef": {
      "type": "object",
      "required": ["name", "version", "uri", "digest"],
      "properties": {
        "name": { "type": "string" },
        "version": { "type": "string" },
        "uri": { "type": "string" },
        "digest": { "type": "string" }
      }
    },
    "provenance": {
      "type": "object",
      "required": ["type"],
      "properties": {
        "type": { "type": "string" },
        "connector": { "type": "string" },
        "name": { "type": "string" },
        "ref": { "type": "string" },
        "precedence": { "type": "integer", "minimum": 0 }
      }
    },
    "support": {
      "type": "object",
      "required": ["observations", "trace_count"],
      "properties": {
        "observations": { "type": "integer", "minimum": 0 },
        "trace_count": { "type": "integer", "minimum": 0 },
        "evidence": {
          "type": "array",
          "items": { "type": "string" }
        }
      }
    },
    "commonMetadata": {
      "type": "object",
      "properties": {
        "labels": {
          "type": "object",
          "additionalProperties": { "type": "string" }
        },
        "tags": {
          "type": "array",
          "items": { "type": "string" }
        },
        "slo_refs": {
          "type": "array",
          "items": { "type": "string" }
        }
      }
    },
    "edgeIdentity": {
      "type": "object",
      "properties": {
        "protocol": { "type": "string" },
        "operation": { "type": "string" },
        "route": { "type": "string" },
        "topic": { "type": "string" },
        "span_kind": { "type": "string" }
      }
    },
    "reliabilityEvidence": {
      "type": "object",
      "required": ["live_probability"],
      "properties": {
        "live_probability": { "type": "number", "minimum": 0, "maximum": 1 },
        "source": { "type": "string" },
        "confidence": { "type": "number", "minimum": 0, "maximum": 1 }
      }
    },
    "discoveryCommonMetadata": {
      "allOf": [
        { "$ref": "#/$defs/commonMetadata" },
        {
          "type": "object",
          "properties": {
            "attributes": {
              "type": "object",
              "additionalProperties": { "type": "string" }
            }
          }
        }
      ]
    },
    "placement": {
      "type": "object",
      "required": ["replicas"],
      "properties": {
        "replicas": { "type": "integer", "minimum": 0 },
        "labels": {
          "type": "object",
          "additionalProperties": { "type": "string" }
        },
        "reliability": { "$ref": "#/$defs/reliabilityEvidence" }
      }
    },
    "serviceMetadata": {
      "allOf": [
        { "$ref": "#/$defs/commonMetadata" },
        {
          "type": "object",
          "properties": {
            "reliability": { "$ref": "#/$defs/reliabilityEvidence" },
            "failure_eligible": { "type": "boolean" },
            "placements": {
              "type": "array",
              "items": { "$ref": "#/$defs/placement" }
            },
            "shared_resource_refs": {
              "type": "array",
              "items": { "type": "string" }
            }
          }
        }
      ]
    },
    "serviceRecordMetadata": {
      "allOf": [
        { "$ref": "#/$defs/discoveryCommonMetadata" },
        {
          "type": "object",
          "properties": {
            "reliability": { "$ref": "#/$defs/reliabilityEvidence" },
            "failure_eligible": { "type": "boolean" },
            "replicas_override": { "type": "integer", "minimum": 0 },
            "placements": {
              "type": "array",
              "items": { "$ref": "#/$defs/placement" }
            },
            "shared_resource_refs": {
              "type": "array",
              "items": { "type": "string" }
            }
          }
        }
      ]
    },
    "edgeMetadata": {
      "allOf": [
        { "$ref": "#/$defs/commonMetadata" },
        {
          "type": "object",
          "properties": {
            "weight": { "type": "number", "minimum": 0 },
            "reliability": { "$ref": "#/$defs/reliabilityEvidence" }
          }
        }
      ]
    },
    "edgeRecordMetadata": {
      "allOf": [
        { "$ref": "#/$defs/discoveryCommonMetadata" },
        {
          "type": "object",
          "properties": {
            "weight": { "type": "number", "minimum": 0 },
            "reliability": { "$ref": "#/$defs/reliabilityEvidence" }
          }
        }
      ]
    },
    "endpointSemantics": {
      "type": "object",
      "properties": {
        "predicate_mode": {
          "type": "string",
          "enum": ["immediate_response", "eventual_completion", "external_predicate"]
        },
        "mandatory_targets": {
          "type": "array",
          "items": { "type": "string" },
          "uniqueItems": true
        },
        "dependency_modes": {
          "type": "array",
          "items": {
            "type": "string",
            "enum": ["sync", "async"]
          },
          "uniqueItems": true
        },
        "source": { "type": "string" },
        "confidence": { "type": "number", "minimum": 0, "maximum": 1 }
      }
    },
    "endpointMetadata": {
      "allOf": [
        { "$ref": "#/$defs/commonMetadata" },
        {
          "type": "object",
          "properties": {
            "weight": { "type": "number", "minimum": 0 },
            "semantics": { "$ref": "#/$defs/endpointSemantics" }
          }
        }
      ]
    },
    "endpointRecordMetadata": {
      "allOf": [
        { "$ref": "#/$defs/discoveryCommonMetadata" },
        {
          "type": "object",
          "properties": {
            "weight": { "type": "number", "minimum": 0 },
            "semantics": { "$ref": "#/$defs/endpointSemantics" },
            "predicate_ref": { "type": "string" }
          }
        }
      ]
    },
    "backoffPolicy": {
      "type": "object",
      "properties": {
        "initial_ms": { "type": "integer", "minimum": 0 },
        "max_ms": { "type": "integer", "minimum": 0 },
        "multiplier": { "type": "number", "minimum": 0 },
        "jitter": { "type": "string" }
      }
    },
    "retryPolicy": {
      "type": "object",
      "properties": {
        "max_attempts": { "type": "integer", "minimum": 0 },
        "budget_cap": { "type": "number", "minimum": 0 },
        "retry_on": {
          "type": "array",
          "items": { "type": "string" }
        },
        "backoff": { "$ref": "#/$defs/backoffPolicy" }
      }
    },
    "circuitBreakerPolicy": {
      "type": "object",
      "properties": {
        "enabled": { "type": "boolean" },
        "max_pending_requests": { "type": "integer", "minimum": 0 },
        "max_requests": { "type": "integer", "minimum": 0 },
        "max_connections": { "type": "integer", "minimum": 0 },
        "consecutive_5xx": { "type": "integer", "minimum": 0 },
        "interval_ms": { "type": "integer", "minimum": 0 },
        "base_ejection_time_ms": { "type": "integer", "minimum": 0 }
      }
    },
    "resiliencePolicy": {
      "type": "object",
      "properties": {
        "request_timeout_ms": { "type": "integer", "minimum": 0 },
        "per_try_timeout_ms": { "type": "integer", "minimum": 0 },
        "retry": { "$ref": "#/$defs/retryPolicy" },
        "circuit_breaker": { "$ref": "#/$defs/circuitBreakerPolicy" }
      }
    },
    "latencySummary": {
      "type": "object",
      "properties": {
        "p50": { "type": "number", "minimum": 0 },
        "p90": { "type": "number", "minimum": 0 },
        "p95": { "type": "number", "minimum": 0 },
        "p99": { "type": "number", "minimum": 0 }
      }
    },
    "observedEdge": {
      "type": "object",
      "properties": {
        "latency_ms": { "$ref": "#/$defs/latencySummary" },
        "error_rate": { "type": "number", "minimum": 0, "maximum": 1 }
      }
    },
    "policyScope": {
      "type": "object",
      "properties": {
        "source_endpoint_id": { "type": "string" },
        "source_route": { "type": "string" },
        "method": { "type": "string" },
        "operation": { "type": "string" }
      }
    },
    "serviceRecord": {
      "type": "object",
      "required": ["id", "name", "replicas", "support"],
      "properties": {
        "id": { "type": "string" },
        "name": { "type": "string" },
        "replicas": { "type": "integer", "minimum": 0 },
        "support": { "$ref": "#/$defs/support" },
        "first_seen": { "type": "string", "format": "date-time" },
        "last_seen": { "type": "string", "format": "date-time" },
        "provenance": {
          "type": "array",
          "items": { "$ref": "#/$defs/provenance" }
        },
        "metadata": { "$ref": "#/$defs/serviceRecordMetadata" }
      }
    },
    "edgeRecord": {
      "type": "object",
      "required": ["id", "from", "to", "kind", "blocking", "support"],
      "properties": {
        "id": { "type": "string" },
        "from": { "type": "string" },
        "to": { "type": "string" },
        "kind": { "type": "string", "enum": ["sync", "async"] },
        "blocking": { "type": "boolean" },
        "identity": { "$ref": "#/$defs/edgeIdentity" },
        "support": { "$ref": "#/$defs/support" },
        "first_seen": { "type": "string", "format": "date-time" },
        "last_seen": { "type": "string", "format": "date-time" },
        "provenance": {
          "type": "array",
          "items": { "$ref": "#/$defs/provenance" }
        },
        "metadata": { "$ref": "#/$defs/edgeRecordMetadata" },
        "resilience": { "$ref": "#/$defs/resiliencePolicy" },
        "observed": { "$ref": "#/$defs/observedEdge" },
        "policy_scope": { "$ref": "#/$defs/policyScope" }
      }
    },
    "endpointRecord": {
      "type": "object",
      "required": ["id", "entry_service", "support"],
      "properties": {
        "id": { "type": "string" },
        "entry_service": { "type": "string" },
        "method": { "type": "string" },
        "path": { "type": "string" },
        "support": { "$ref": "#/$defs/support" },
        "first_seen": { "type": "string", "format": "date-time" },
        "last_seen": { "type": "string", "format": "date-time" },
        "provenance": {
          "type": "array",
          "items": { "$ref": "#/$defs/provenance" }
        },
        "metadata": { "$ref": "#/$defs/endpointRecordMetadata" }
      }
    },
    "modelService": {
      "type": "object",
      "required": ["id", "name", "replicas"],
      "properties": {
        "id": { "type": "string" },
        "name": { "type": "string" },
        "replicas": { "type": "integer", "minimum": 0 },
        "metadata": { "$ref": "#/$defs/serviceMetadata" }
      }
    },
    "modelEdge": {
      "type": "object",
      "required": ["id", "from", "to", "kind", "blocking"],
      "properties": {
        "id": { "type": "string" },
        "from": { "type": "string" },
        "to": { "type": "string" },
        "kind": { "type": "string", "enum": ["sync", "async"] },
        "blocking": { "type": "boolean" },
        "identity": { "$ref": "#/$defs/edgeIdentity" },
        "metadata": { "$ref": "#/$defs/edgeMetadata" },
        "resilience": { "$ref": "#/$defs/resiliencePolicy" },
        "observed": { "$ref": "#/$defs/observedEdge" },
        "policy_scope": { "$ref": "#/$defs/policyScope" }
      }
    },
    "modelEndpoint": {
      "type": "object",
      "required": ["id", "entry_service", "success_predicate_ref"],
      "properties": {
        "id": { "type": "string" },
        "entry_service": { "type": "string" },
        "success_predicate_ref": { "type": "string" },
        "method": { "type": "string" },
        "path": { "type": "string" },
        "metadata": { "$ref": "#/$defs/endpointMetadata" }
      }
    }
  }
}
