{
  "counts": {
    "edges": 3,
    "endpoints": 3,
    "services": 4
  },
  "coverage": {
    "confidence": 0.94,
    "edge_support_min": 1,
    "endpoint_support_min": 1,
    "service_support_min": 1
  },
  "diff": {
    "added_edges": 3,
    "added_endpoints": 3,
    "added_services": 4,
    "changed_edges": 0,
    "changed_endpoints": 0,
    "changed_services": 0,
    "removed_edges": 0,
    "removed_endpoints": 0,
    "removed_services": 0
  },
  "discovery": {
    "edges": [
      {
        "blocking": true,
        "from": "checkout",
        "id": "checkout|inventory|sync|true|protocol=http|route=%2Fprocess|span_kind=client",
        "identity": {
          "protocol": "http",
          "route": "/process",
          "span_kind": "client"
        },
        "kind": "sync",
        "observed": {
          "latency_ms": {
            "p50": 25,
            "p90": 25,
            "p95": 25,
            "p99": 25
          }
        },
        "provenance": [
          {
            "connector": "trace_file",
            "ref": "bering://discover?input=examples%2Ftraces%2Fnormalized.sample.json",
            "type": "traces"
          }
        ],
        "support": {
          "evidence": [
            "default_sync"
          ],
          "observations": 1,
          "trace_count": 1
        },
        "to": "inventory"
      },
      {
        "blocking": false,
        "from": "checkout",
        "id": "checkout|payment|async|false|protocol=http|route=%2Fprocess|topic=payment-events|span_kind=consumer",
        "identity": {
          "protocol": "http",
          "route": "/process",
          "span_kind": "consumer",
          "topic": "payment-events"
        },
        "kind": "async",
        "observed": {
          "latency_ms": {
            "p50": 12,
            "p90": 12,
            "p95": 12,
            "p99": 12
          }
        },
        "provenance": [
          {
            "connector": "trace_file",
            "ref": "bering://discover?input=examples%2Ftraces%2Fnormalized.sample.json",
            "type": "traces"
          }
        ],
        "support": {
          "evidence": [
            "child_async_signal",
            "messaging.destination",
            "messaging.system",
            "span.kind=consumer"
          ],
          "observations": 1,
          "trace_count": 1
        },
        "to": "payment"
      },
      {
        "blocking": true,
        "from": "frontend",
        "id": "frontend|checkout|sync|true|protocol=http|operation=POST|route=%2Fprocess|span_kind=server",
        "identity": {
          "operation": "POST",
          "protocol": "http",
          "route": "/process",
          "span_kind": "server"
        },
        "kind": "sync",
        "observed": {
          "latency_ms": {
            "p50": 60,
            "p90": 60,
            "p95": 60,
            "p99": 60
          }
        },
        "provenance": [
          {
            "connector": "trace_file",
            "ref": "bering://discover?input=examples%2Ftraces%2Fnormalized.sample.json",
            "type": "traces"
          }
        ],
        "support": {
          "evidence": [
            "default_sync"
          ],
          "observations": 1,
          "trace_count": 1
        },
        "to": "checkout"
      }
    ],
    "endpoints": [
      {
        "entry_service": "checkout",
        "id": "checkout:POST /process",
        "method": "POST",
        "path": "/process",
        "provenance": [
          {
            "connector": "trace_file",
            "ref": "bering://discover?input=examples%2Ftraces%2Fnormalized.sample.json",
            "type": "traces"
          }
        ],
        "support": {
          "observations": 1,
          "trace_count": 1
        }
      },
      {
        "entry_service": "frontend",
        "id": "frontend:GET /checkout",
        "method": "GET",
        "path": "/checkout",
        "provenance": [
          {
            "connector": "trace_file",
            "ref": "bering://discover?input=examples%2Ftraces%2Fnormalized.sample.json",
            "type": "traces"
          }
        ],
        "support": {
          "observations": 1,
          "trace_count": 1
        }
      },
      {
        "entry_service": "frontend",
        "id": "frontend:GET /health",
        "method": "GET",
        "path": "/health",
        "provenance": [
          {
            "connector": "trace_file",
            "ref": "bering://discover?input=examples%2Ftraces%2Fnormalized.sample.json",
            "type": "traces"
          }
        ],
        "support": {
          "observations": 1,
          "trace_count": 1
        }
      }
    ],
    "services": [
      {
        "id": "checkout",
        "name": "checkout",
        "provenance": [
          {
            "connector": "trace_file",
            "ref": "bering://discover?input=examples%2Ftraces%2Fnormalized.sample.json",
            "type": "traces"
          }
        ],
        "replicas": 1,
        "support": {
          "observations": 1,
          "trace_count": 1
        }
      },
      {
        "id": "frontend",
        "name": "frontend",
        "provenance": [
          {
            "connector": "trace_file",
            "ref": "bering://discover?input=examples%2Ftraces%2Fnormalized.sample.json",
            "type": "traces"
          }
        ],
        "replicas": 1,
        "support": {
          "observations": 2,
          "trace_count": 2
        }
      },
      {
        "id": "inventory",
        "name": "inventory",
        "provenance": [
          {
            "connector": "trace_file",
            "ref": "bering://discover?input=examples%2Ftraces%2Fnormalized.sample.json",
            "type": "traces"
          }
        ],
        "replicas": 1,
        "support": {
          "observations": 1,
          "trace_count": 1
        }
      },
      {
        "id": "payment",
        "name": "payment",
        "provenance": [
          {
            "connector": "trace_file",
            "ref": "bering://discover?input=examples%2Ftraces%2Fnormalized.sample.json",
            "type": "traces"
          }
        ],
        "replicas": 1,
        "support": {
          "observations": 1,
          "trace_count": 1
        }
      }
    ]
  },
  "ingest": {
    "dropped_spans": 0,
    "late_spans": 0,
    "spans": 5,
    "traces": 2
  },
  "metadata": {
    "confidence": 0.94,
    "emitted_at": "2026-03-03T00:00:00Z",
    "schema": {
      "digest": "sha256:cb737b0a4038e0bf30a397ca7ba7ff017d684fe3b25e7d8e3ae74ac59b45210b",
      "name": "io.mb3r.bering.snapshot",
      "uri": "https://mb3r-lab.github.io/Bering/schema/snapshot/v1.2.0/snapshot.schema.json",
      "version": "1.2.0"
    },
    "source_ref": "bering://discover?input=examples%2Ftraces%2Fnormalized.sample.json",
    "source_type": "bering"
  },
  "model": {
    "edges": [
      {
        "blocking": true,
        "from": "checkout",
        "id": "checkout|inventory|sync|true|protocol=http|route=%2Fprocess|span_kind=client",
        "identity": {
          "protocol": "http",
          "route": "/process",
          "span_kind": "client"
        },
        "kind": "sync",
        "observed": {
          "latency_ms": {
            "p50": 25,
            "p90": 25,
            "p95": 25,
            "p99": 25
          }
        },
        "to": "inventory"
      },
      {
        "blocking": false,
        "from": "checkout",
        "id": "checkout|payment|async|false|protocol=http|route=%2Fprocess|topic=payment-events|span_kind=consumer",
        "identity": {
          "protocol": "http",
          "route": "/process",
          "span_kind": "consumer",
          "topic": "payment-events"
        },
        "kind": "async",
        "observed": {
          "latency_ms": {
            "p50": 12,
            "p90": 12,
            "p95": 12,
            "p99": 12
          }
        },
        "to": "payment"
      },
      {
        "blocking": true,
        "from": "frontend",
        "id": "frontend|checkout|sync|true|protocol=http|operation=POST|route=%2Fprocess|span_kind=server",
        "identity": {
          "operation": "POST",
          "protocol": "http",
          "route": "/process",
          "span_kind": "server"
        },
        "kind": "sync",
        "observed": {
          "latency_ms": {
            "p50": 60,
            "p90": 60,
            "p95": 60,
            "p99": 60
          }
        },
        "to": "checkout"
      }
    ],
    "endpoints": [
      {
        "entry_service": "checkout",
        "id": "checkout:POST /process",
        "method": "POST",
        "path": "/process",
        "success_predicate_ref": "checkout:POST /process"
      },
      {
        "entry_service": "frontend",
        "id": "frontend:GET /checkout",
        "method": "GET",
        "path": "/checkout",
        "success_predicate_ref": "frontend:GET /checkout"
      },
      {
        "entry_service": "frontend",
        "id": "frontend:GET /health",
        "method": "GET",
        "path": "/health",
        "success_predicate_ref": "frontend:GET /health"
      }
    ],
    "metadata": {
      "confidence": 0.94,
      "discovered_at": "2026-03-03T00:00:00Z",
      "schema": {
        "digest": "sha256:4fa1a34e64703524cfe2289341fcea79986265db08c0220d6c89e38c0ff76bf8",
        "name": "io.mb3r.bering.model",
        "uri": "https://mb3r-lab.github.io/Bering/schema/model/v1.2.0/model.schema.json",
        "version": "1.2.0"
      },
      "source_ref": "bering://discover?input=examples%2Ftraces%2Fnormalized.sample.json",
      "source_type": "bering"
    },
    "services": [
      {
        "id": "checkout",
        "name": "checkout",
        "replicas": 1
      },
      {
        "id": "frontend",
        "name": "frontend",
        "replicas": 1
      },
      {
        "id": "inventory",
        "name": "inventory",
        "replicas": 1
      },
      {
        "id": "payment",